{
  "$schema": "https://json-schema.org/draft/2020-12/schema",
  "$id": "schema://frank.module/v1",
  "title": "FRANK module manifest",
  "description": "FRANK-§6.1. A versioned, schema-validated module declaration specifying capabilities, dependencies, data access, UI routes, events, and health checks.",
  "type": "object",
  "additionalProperties": false,
  "required": [
    "schema",
    "id",
    "name",
    "version",
    "kind",
    "depends_on",
    "provides",
    "data_scopes",
    "ui",
    "events",
    "permissions",
    "health_checks"
  ],
  "properties": {
    "schema": { "const": "frank.module/v1" },
    "id": {
      "description": "Module identifier in dot-separated lowercase form, e.g. brain.youtube.",
      "type": "string",
      "pattern": "^[a-z0-9]+([._-][a-z0-9]+)*$"
    },
    "name": {
      "description": "Human-readable module name.",
      "type": "string",
      "minLength": 1
    },
    "version": {
      "description": "Semantic version of the module.",
      "type": "string",
      "pattern": "^\\d+\\.\\d+\\.\\d+(-[a-zA-Z0-9]+(\\.[a-zA-Z0-9]+)*)?(\\+[a-zA-Z0-9]+(\\.[a-zA-Z0-9]+)*)?$"
    },
    "kind": {
      "description": "Module classification: feature, integration, policy, workflow, or system.",
      "type": "string",
      "enum": ["feature", "integration", "policy", "workflow", "system"]
    },
    "depends_on": {
      "description": "Array of module dependency specifications with semantic version constraints.",
      "type": "array",
      "items": {
        "type": "string",
        "minLength": 1
      }
    },
    "provides": {
      "description": "Array of capabilities this module exports to the system.",
      "type": "array",
      "items": {
        "type": "string",
        "minLength": 1
      }
    },
    "data_scopes": {
      "description": "FRANK-§2.3. Array of data classification levels this module is approved to process.",
      "type": "array",
      "items": {
        "$ref": "schema://frank.classification/v1#/$defs/DataClass"
      },
      "minItems": 1
    },
    "ui": {
      "description": "User interface routes and widgets exposed by this module.",
      "type": "object",
      "additionalProperties": false,
      "required": ["routes", "widgets"],
      "properties": {
        "routes": {
          "description": "Array of route paths provided by this module.",
          "type": "array",
          "items": {
            "type": "string",
            "minLength": 1
          }
        },
        "widgets": {
          "description": "Array of widget identifiers provided by this module.",
          "type": "array",
          "items": {
            "type": "string",
            "minLength": 1
          }
        }
      }
    },
    "events": {
      "description": "Event types consumed and emitted by this module.",
      "type": "object",
      "additionalProperties": false,
      "required": ["consumes", "emits"],
      "properties": {
        "consumes": {
          "description": "Array of event type patterns this module subscribes to.",
          "type": "array",
          "items": {
            "type": "string",
            "minLength": 1
          }
        },
        "emits": {
          "description": "Array of event types this module produces.",
          "type": "array",
          "items": {
            "type": "string",
            "minLength": 1
          }
        }
      }
    },
    "permissions": {
      "description": "Authorization scopes required by this module.",
      "type": "object",
      "additionalProperties": false,
      "required": ["required"],
      "properties": {
        "required": {
          "description": "Array of permission identifiers required for operation.",
          "type": "array",
          "items": {
            "type": "string",
            "minLength": 1
          }
        }
      }
    },
    "health_checks": {
      "description": "Named health check points that verify module dependencies and critical paths.",
      "type": "array",
      "items": {
        "type": "string",
        "minLength": 1
      }
    }
  }
}
